报告范围=["每月"],选择年份=["2025"],选择月份=["1 月"],品牌=["Ikarao"]
"ASIN 商品名称",ASIN,分类,"曝光: 曝光总量",曝光量：评级（中位数）,"曝光：售价(中位数)",曝光：当日达配送速度,"曝光量：1 天配送速度","曝光量：2 天配送速度","点击: 点击量","点击：点击率 （CTR）","点击量：价格(中位数)",点击量：当日达配送速度,"点击量：1 天配送速度",点击：2天配送速度,"加入购物车 : 加购数",加入购物车：售价（中位数）,购物车添加：当日达配送速度,"加入购物车：1 天配送速度","购物车添加：2 天配送速度",下单成交：成交总量,下单成交：搜索来源销售额,"购买次数：转化率 %",购买次数：评分（中位数）,购买次数：价格（中位数）,下单成交：当日达配送速度,"下单成交：1 天配送速度",下单：2天配送速度,报告日期
"Ikarao Karaoke Machine for Adults with Lyrics Display, Built-in 13.3"" Screen, Truly All in One Karaoke Machine with 2 Wireless Microphone (Hidden & Self Charging), 800W Bluetooth Speaker for Party, TV","B0CLLT85Y6","Musical Instruments","29503",,"659.99","0","2431","12562","1371","4.65","659.99","0","106","546","242","659.99","0","21","97","43","26480.21","3.14",,"659.99","0","6","20","2025-01-31"
"Ikarao Speaker Stand Tripod Adjustable Height 32"" to 47"", Max Load 66LBS, with 35mm Insert(Compatible with JBL, Bose, Ikarao, Alto, Mackie, etc.), Speaker Tripod for Heavy Duty Speaker, PA, DJ, Stage","B0CP1VM45S","Musical Instruments","32033",,"38.99","0","907","3852","785","2.45","38.99","0","15","95","172","38.99","0","4","25","42","1793.54","5.35",,"38.99","0","0","6","2025-01-31"
"Ikarao Smart Karaoke Machine for Adults - with Lyrics Display, 64GB Karaoke Tablet, 2 Wireless Mics, Professional Karaoke System, 600W Peak Power, 4 DJ Lights, Karaoke Speaker for Any Occasion","B0CR1R7FKP","Musical Instruments","694627",,"469.99","6","68501","279767","10418","1.5","469.99","0","1054","4131","1291","469.99","0","136","514","206","90476.0","1.98",,"469.99","0","26","87","2025-01-31"
"Bluetooth Speaker with Microphone, 2 Wireless Self-Charging Mics, All-in-One Storage, Multi-Function Party Smart Speakers, Built-in 10.1"" Media Screen, Supports WiFi, AUX, HDMI for TV, 280W Loud Audio","B0D6Z2228K","Musical Instruments","62161",,"349.99","0","10438","27479","377","0.61","349.99","0","79","156","41","349.99","0","9","18","4","1399.96","1.06",,"349.99","0","1","1","2025-01-31"
"Ikarao Smart Karaoke Machine, Built-in 10.1"" Screen Lyrics Display for Adults Kids, 2 Auto Charging Wireless Microphones, Portable Bluetooth Speaker PA System with WiFi, HDMI for Home TV Outdoor Party","B0DCZQX11P","Musical Instruments","412857",,"349.99","74","17299","119100","4023","0.97","349.99","0","186","1181","680","349.99","0","26","203","140","48438.58","3.48",,"349.99","0","2","50","2025-01-31"
"Ikarao Karaoke Machine with Microphone Stand, Portable Bluetooth Speaker for Party, Backyard, Karaoke System with 2 Wireless Microphone for Adults Kids, for Women, Men, Singing Lovers","B0DH1P8M7M","Musical Instruments","1108",,"469.99","0","59","300","11","0.99","469.99","0","1","5","1","469.99","0","0","0","0","0.0","0.0",,,"0","0","0","2025-01-31"
"Ikarao Portable Karaoke Machine for Adults, Built-in Lyrics Display and Screen, 2 Self-Charging Wireless Microphones, Karaoke App, 140W Speaker, Connects to TV for Home Party Birthday Outdoor Camping","B0DHPN1DMJ","Musical Instruments","741088",,"349.99","45335","361733","169637","8622","1.16","349.99","604","4133","2036","1197","349.99","90","595","268","190","63767.58","2.2",,"349.99","16","113","39","2025-01-31"
"Ikarao Speaker with Microphone, 280W Deep Bass for Party, Two Microphones, 10.1"" Screen Lyrics Display, Loud Wireless Speakers, 12H Playtime, Support Bluetooth WiFi, HDMI for Home TV, Outdoor","B0DP3295MS","Musical Instruments","155769",,"349.99","1956","38560","52156","1371","0.88","349.99","17","369","476","144","349.99","3","41","54","20","6999.8","1.46",,"349.99","0","11","7","2025-01-31"
"Portable Party Bluetooth Speaker, 140W Speaker with Self-Charging Microphone, Screen Lyrics Display, Deep Bass, Dynamic Lights, Loud Wireless Karaoke Speaker, Support WiFi AUX HDMI for TV/Projector","B0DP4236FZ","Electronics","730",,"349.99","4","189","365","2","0.27","349.99","0","1","1","0",,"0","0","0","0","0.0","0.0",,,"0","0","0","2025-01-31"
"Ikarao Karaoke Machine, with Lyrics Display Screen for Adults Kids, Smart EQ & Vocals Autotune, 2 Bluetooth Wireless Mic, Portable Bluetooth Speaker PA System for Home, Birthday Party, Outdoor Camping","B0DPX3MS2Z","Musical Instruments","6075",,"299.99","0","638","2719","138","2.27","299.99","0","19","69","15","299.99","0","1","5","3","899.97","2.17",,"299.99","0","0","2","2025-01-31"
